{"type":"config","name":"zsh startup — Zellij subshell vs fresh shell","metricName":"zellij_ms","metricUnit":"ms","bestDirection":"lower"}
{"run":1,"commit":"4467ff5","metric":152,"metrics":{"fresh_ms":141,"p90_zellij_ms":1338,"p90_fresh_ms":219},"status":"keep","description":"Baseline: current config + add hyperfine to packages","timestamp":1776539360608,"segment":0,"confidence":null,"iterationTokens":3337,"asi":{"hypothesis":"baseline measurement","note":"p90_zellij_ms=1338 is a single cold-start outlier (1 of 7 runs); median 152ms is reliable. Fresh shell median 141ms slightly lower than zellij because MISE_SHELL causes the nested (faster) mise init to be bypassed in fresh — wait, that's backwards. Fresh unsets MISE_SHELL so it runs full mise init. p90_fresh=219ms also shows some jitter. Add a warmup run if p90s stay noisy."}}
{"run":2,"commit":"c8f0dd0","metric":126,"metrics":{"fresh_ms":155,"p90_zellij_ms":155,"p90_fresh_ms":212},"status":"keep","description":"Skip fnm subprocess in Zellij panes; source pre-built static shims instead","timestamp":1776539427406,"segment":0,"confidence":null,"iterationTokens":3307,"asi":{"hypothesis":"fnm env --use-on-cd forks a subprocess and creates a new multishell dir (~27ms). In Zellij panes PATH+FNM_* are inherited so we only need the shell functions/alias.","result":"zellij: 152->126ms (-26ms, -17%). fresh: 141->155ms (expected: still runs full fnm eval). warmup run also fixed p90 outlier.","mechanism":"pre-built fnmZshInit nix derivation strips PATH/env exports; guarded by [[ -n $ZELLIJ ]]"}}
{"run":3,"commit":"c8f0dd0","metric":137,"metrics":{"fresh_ms":150,"p90_zellij_ms":168,"p90_fresh_ms":197},"status":"discard","description":"Defer fzf-tab/npm-autocomplete/history-substring-search via zsh-defer","timestamp":1776539697381,"segment":0,"confidence":2.3636363636363638,"iterationTokens":8053,"asi":{"hypothesis":"defer 3 eager plugins (~20ms combined) via zsh-defer to save startup time","rollback_reason":"build broke: fnmZshInit derivation runs `fnm env --use-on-cd` inside nix sandbox which has no HOME (/homeless-shelter), so fnm can't create its multishell dir. Also result 137ms vs 126ms prev-best is within noise (σ≈13ms from hyperfine). Two separate bugs.","next_action_hint":"Fix fnmZshInit to use pkgs.writeText with hand-written static shims (no execution needed). Then separately retry deferring the 3 plugins.","key_insight":"pkgs.runCommand cannot call tools that need $HOME at build time. Use pkgs.writeText for static content. Also: noise floor is ~13-20ms so small gains may not be measurable with RUNS=7."}}
{"run":4,"commit":"c892314","metric":104,"metrics":{"fresh_ms":136,"p90_zellij_ms":151,"p90_fresh_ms":186},"status":"keep","description":"Fix fnmZshInit (writeText, no sandbox failure) + defer fzf-tab/npm-scripts/history-substring-search + fix just home masking","timestamp":1776540182883,"segment":0,"confidence":3.6923076923076925,"iterationTokens":8302,"asi":{"hypothesis":"pkgs.runCommand for fnmZshInit was silently failing in nix sandbox (HOME=/homeless-shelter); || true in autoresearch.sh masked the failure so benchmark measured old deployed config. Fixed with pkgs.writeText. Also deferred 3 plugins.","result":"zellij: 152->104ms (-32%). Both wins stack: fnm ZELLIJ guard saves ~27ms, 3 deferred plugins save ~21ms.","key_lesson":"always hard-fail on just home in the benchmark script"}}
{"run":5,"commit":"c892314","metric":89,"metrics":{"fresh_ms":142,"p90_zellij_ms":128,"p90_fresh_ms":227},"status":"keep","description":"Strip 1933 duplicate fpath entries before compinit; drop redundant eza FPATH export","timestamp":1776540798594,"segment":0,"confidence":2.8636363636363638,"iterationTokens":36317,"asi":{"hypothesis":"three near-identical copies of zsh 5.9/functions in fpath (~2985 total files). Removing /run/current-system and /usr/share duplicates reduces to ~1052 files.","result":"zellij: 104->89ms (-15ms). compdump: 2985->1052 files, 2505->2119 lines, fpath: 21->13 entries. eza completions intact via site-functions.","mechanism":"fpath filter in completionInit runs before compinit; home.activation.zcompdump wipes dump so it regenerates smaller on next just home","key_finding":"all vendor-completions dirs empty; /usr/share/zsh/5.9 has zero unique files vs nix-profile; eza _eza already in site-functions"}}
{"run":6,"commit":"41bc7e5","metric":93,"metrics":{"fresh_ms":146,"p90_zellij_ms":158,"p90_fresh_ms":193},"status":"discard","description":"Remove duplicate zsh-autosuggestions from plugins array","timestamp":1776541143797,"segment":0,"confidence":2.8636363636363638,"iterationTokens":20022,"asi":{"hypothesis":"autosuggestions loaded twice: once by autosuggestion.enable, once by plugins array. Removing plugins entry saves ~2ms.","rollback_reason":"93ms vs 89ms prev-best — within noise but technically worse. autosuggestions is cheap to source twice (it guards against double-init internally). Not worth keeping.","next_action_hint":"At 89ms we're near the floor: ZLE overhead ~30ms + compinit ~15ms (no-touch) + starship ~9ms + autoenv/histdb/custom-init ~16ms. Try zshrc .zwc precompilation via home.activation or look at reducing starship init cost.","key_finding":"autosuggestions double-load is essentially free due to internal guards"}}
